ID,Land,Postleitzahl,Datum,Uhrzeit,Stadt,Treffpunkt,Protestform,Zeitstempel,Livestream
6799,DE,86156,2021-01-24,14:30,Augsburg,PR West Parkplatz Kriegshaber,Autokorso,2021-01-22 08:58:36,
6797,DE,14480,2021-01-25,18:00,Potsdam,Platz zwischen Filmmuseum und,Kundgebung,2021-01-22 08:09:44,
6798,DE,86343,2021-01-27,19:00,Königsbrunn,Marktplatz vor dem Rathaus,Kundgebung,2021-01-22 08:52:43,
6801,DE,86343,2021-02-03,19:00,Königsbrunn,Marktplatz vor dem Rathaus,Kundgebung,2021-01-22 09:01:32,
6800,DE,86150,2021-02-27,14:30,Augsburg,Ulrichsplatz,Demonstration,2021-01-22 09:00:47,
